{
  "id":"palau-rock-islands","collection":"hundred","status":"fact_checked","last_verified":"2026-08-23",
  "identity":{"name_fr":"Îles Rocheuses et lagon sud de Palau","name_official":"Rock Islands Southern Lagoon","name_local":[{"lang":"pau","value":"Chelbacheb"}],"name_indigenous":[{"people":"Palauan","value":"Chelbacheb","meaning":"Nom paluan des Rock Islands"}],"aka":["Rock Islands","Southern Lagoon","Chelbacheb"]},
  "location":{"countries":["PW"],"country_labels":["Palau"],"subdivision":"État de Koror","region":"oceanie","lat":7.247,"lng":134.353,"coordinate_precision":"region","bbox":[134.2,7.05,134.55,7.45],"area_km2":1002,"elevation_min_m":0,"elevation_max_m":207,"depth_max_m":80,"timezone":"Pacific/Palau"},
  "landscape":{"primary":"ile","types":["ile","ocean","atoll","karst","lac","foret-tropicale"],"family":"marin","iucn_ecosystem":["M1.3 Récifs coralliens tropicaux","M1.4 Lacs marins","MT1.2 Îles calcaires tropicales"],"biome":"Îles de calcaire récifal soulevé, lagon, récifs et lacs marins isolés","climate":"Équatorial océanique, chaud et humide, soumis aux pluies intenses et anomalies El Niño","collections":["royaumes-eau","sous-la-surface","grands-rassemblements","autre-planete"]},
  "protection":{"designations":[{"type":"unesco-mixte","name":"Rock Islands Southern Lagoon","since":2012,"criteria":["iii","v","vii","ix","x"],"ref":"1386","url":"https://whc.unesco.org/en/list/1386"},{"type":"marine-protected","name":"Rock Islands Southern Lagoon protected areas","since":1994,"criteria":[],"ref":null,"url":"https://whc.unesco.org/en/list/1386"}],"managing_body":{"name":"Koror State Government et communautés paluanes","url":"https://whc.unesco.org/en/list/1386"}},
  "editorial":{"badges":["unique-au-monde","ecosysteme-majeur","exceptionnel"],"essential":false,"lede":"Dans un lagon turquoise, 445 îles de calcaire récifal soulevé ont été sapées en champignons verts et enferment cinquante-deux lacs marins, autant d'expériences naturelles d'isolement et d'évolution.","why_here":"Chelbacheb concentre plus de lacs marins que tout autre site connu. Certains communiquent largement avec l'océan par fissures et tunnels; d'autres sont presque isolés, stratifiés et pauvres en oxygène en profondeur. Leurs méduses, éponges et microorganismes ont divergé séparément. Autour, récifs, grottes, arches et forêts insulaires abritent 746 poissons et plus de 385 coraux. Les anciens villages et traditions orales rappellent que ce laboratoire naturel est aussi un paysage ancestral.","presentation":"Les îles paraissent flotter parce que vagues, organismes foreurs et dissolution sapent leur base à hauteur de mer. Au-dessus, une forêt dense couvre le calcaire irrégulier. Tunnels et arches relient certaines criques.\n\nLes lacs marins se sont formés lorsque la mer postglaciaire a envahi des dépressions du karst. Leur connexion souterraine varie; marées, salinité, température et oxygène diffèrent donc d'un lac à l'autre.\n\nLes méduses dorées de certains lacs hébergent des algues symbiotiques et migrent avec la lumière. Leur abondance peut s'effondrer lors de chaleurs ou sécheresses, puis revenir; elles ne garantissent pas un spectacle permanent.","geology":"Palau repose sur un arc volcanique miocène. Des récifs ont grandi autour des îles volcaniques, se sont lithifiés puis ont été soulevés par les mouvements tectoniques. Le calcaire conserve coraux et débris biologiques.\n\nPluie acide et eaux souterraines dissolvent le carbonate, ouvrant cavités et dépressions. Les vagues et organismes marins entaillent une encoche au niveau de l'eau, donnant aux îlots leur silhouette de champignon.\n\nÀ la remontée du niveau marin après la dernière glaciation, des cavités ont été noyées. Les seuils et fissures déterminent aujourd'hui la connexion de chaque lac à l'océan et donc sa trajectoire écologique.","dynamics":"Chaque lac répond différemment aux marées, pluies et chaleur. Un faible mélange peut maintenir une couche profonde anoxique riche en sulfure, dangereuse à perturber. Sur les récifs, blanchissement, tempêtes et recrutement larvaire composent une mosaïque. L'isolement protège certaines lignées mais les rend vulnérables à un seul événement.","biodiversity_text":"L'UNESCO recense 746 poissons, plus de 385 coraux, au moins treize espèces de requins et raies manta, sept bénitiers géants et un nautile endémique. Les forêts contiennent tous les oiseaux, mammifères et reptiles endémiques de Palau, ainsi que près de la moitié des plantes endémiques.","in_motion":"Tourisme, crèmes, contact, navigation et surpêche peuvent dégrader des lacs minuscules. Réchauffement et sécheresses ont déjà modifié les populations de méduses. La réglementation de Koror limite accès et usages; elle prolonge des formes paluanes de gouvernance marine et doit primer sur les attentes des visiteurs.","guess_hints":["Quatre cent quarante-cinq îles calcaires ont une base sapée par la mer","Cinquante-deux lacs marins suivent des trajectoires écologiques distinctes","Des méduses symbiotiques migrent avec la lumière","Les villages abandonnés témoignent de trois millénaires d'usage marin"]},
  "figures":[{"label":"Superficie UNESCO","value":"100 200 ha"},{"label":"Îles calcaires","value":"445"},{"label":"Lacs marins","value":"52"},{"label":"Poissons","value":"746 espèces"},{"label":"Coraux","value":"plus de 385 espèces"}],
  "geology":{"age":"Arc miocène, calcaires récifaux cénozoïques et noyade postglaciaire","processes":["volcanisme d'arc","croissance récifale","lithification","soulèvement","karstification","érosion marine","transgression marine"],"rock_types":["calcaire corallien","débris récifaux","roches volcaniques du socle"],"volcanic":null},
  "biodiversity":{"flagship_species":[{"name_fr":"Méduse dorée","name_sci":"Mastigias papua etpisoni","group":"cnidaire","iucn_status":"NE"},{"name_fr":"Nautile de Palau","name_sci":"Nautilus belauensis","group":"mollusque","iucn_status":"EN"},{"name_fr":"Dugong","name_sci":"Dugong dugon","group":"mammifère","iucn_status":"VU"},{"name_fr":"Raie manta océanique","name_sci":"Mobula birostris","group":"poisson","iucn_status":"EN"}],"endemism_level":"exceptionnel","endemism_note":"Les lacs répètent des isolements à différentes étapes, tandis que les îles et récifs portent de nombreux endémiques paluans.","species_counts":{"fish":746,"corals":385,"note":"L'UNESCO signale aussi au moins 13 requins et raies manta et 7 bénitiers géants."}},
  "seasonality":{"best_months":[2,3,4,5,11,12],"avoid_months":[],"phenomena":[{"label":"Pluies variables toute l'année","kind":"saison-humide","months":[5,6,7,8,9,10]},{"label":"Chaleur et anomalies El Niño pouvant réduire les méduses","kind":"autre","months":[1,2,3,4,5,6,7,8,9,10,11,12]}],"notes":"Ouverture, densité des méduses et qualité de l'eau varient. Vérifier Koror State avant toute visite."},
  "visit":{"accessibility":"difficile","suggested_duration":"4 à 8 jours avec permis et opérateur local","difficulty":"Navigation, chaleur, courants, karst coupant et règles variables selon chaque lac.","extreme_conditions":["chaleur","humidité","orage","courants","eau anoxique","karst coupant"],"permits":"Rock Islands permit et permis spécifiques selon activités et lacs; seuls les sites ouverts par Koror State sont accessibles.","rules":["Ne jamais entrer dans un lac fermé ni plonger sous la profondeur autorisée.","Ne toucher ni méduses, coraux, parois ou vestiges.","N'utiliser aucun produit corporel interdit avant baignade.","Respecter zones sans pêche, vitesse et mouillages.","Ne diffuser ni pénétrer les sites funéraires ou culturels restreints."],"official_url":"https://whc.unesco.org/en/list/1386","no_route_guidance":false},
  "conservation":{"fragility":"critique","state":"Le site reste très riche et peu pêché, mais chaque lac isolé peut basculer rapidement sous chaleur ou fréquentation.","trend":"stable","threats":[{"type":"climat","level":"critique","note":"Chaleur et sécheresse modifient stratification, salinité, méduses et coraux."},{"type":"tourisme","level":"eleve","note":"Affluence, contact et produits chimiques perturbent des volumes d'eau restreints."},{"type":"peche","level":"eleve","note":"Prélèvements et braconnage réduisent prédateurs et grands poissons."},{"type":"pollution","level":"eleve","note":"Eaux usées, carburants et plastiques persistent dans des bassins faiblement renouvelés."}],"understand_without_going":false,"message":"Chaque lac est un monde clos, pas une piscine. Permis, fermeture et capacité définis par Koror protègent une évolution impossible à remplacer."},
  "media":{"hero":null,"gallery":[],"query":"Palau Rock Islands marine lakes jellyfish lagoon aerial"},
  "sources":[{"title":"Rock Islands Southern Lagoon","publisher":"UNESCO World Heritage Centre","url":"https://whc.unesco.org/en/list/1386","type":"officiel","accessed":"2026-08-23"},{"title":"Rock Islands Southern Lagoon nomination","publisher":"UNESCO World Heritage Centre","url":"https://whc.unesco.org/uploads/nominations/1386.pdf","type":"officiel","accessed":"2026-08-23"},{"title":"IUCN technical evaluation 1386","publisher":"IUCN et UNESCO","url":"https://whc.unesco.org/archive/advisory_body_evaluation/1386.pdf","type":"officiel","accessed":"2026-08-23"}],
  "score":{"criteria":{"visuel":5,"singularite":5,"rarete":5,"diversite":5,"integrite":5,"monumentalite":4,"actif":5,"biologique":5,"photogenie":5,"pedagogie":5,"conservation":5,"complementarite":5},"total":129,"scored_on":"2026-08-23"}
}
