{"id":"deception-island","collection":"hundred","status":"fact_checked","last_verified":"2026-08-23","identity":{"name_fr":"Île de la Déception","name_official":"Deception Island","name_local":[],"name_indigenous":null,"aka":["Deception Island"]},"location":{"countries":["AQ"],"country_labels":["Antarctique"],"subdivision":"Îles Shetland du Sud","region":"polaire","lat":-62.95,"lng":-60.633,"coordinate_precision":"region","bbox":[-60.9,-63.05,-60.45,-62.85],"area_km2":98.5,"elevation_min_m":0,"elevation_max_m":539,"depth_max_m":null,"timezone":"Antarctica/Palmer"},"landscape":{"primary":"volcan","types":["volcan","geothermal","ile","polaire","faune"],"family":"feu","iucn_ecosystem":["T6.5 Désert polaire","M1.7 Baies volcaniques"],"biome":"Caldeira volcanique maritime antarctique","climate":"Polaire maritime","collections":["terre-de-feu","autre-planete","grands-rassemblements","bouts-du-monde"]},"protection":{"designations":[{"type":"antarctic-treaty","name":"Zone gérée spéciale de l'Antarctique no 4, île de la Déception","ref":"ASMA 4","since":2005,"criteria":[],"url":"https://documents.ats.aq/recatt/att512_e.pdf"},{"type":"antarctic-treaty","name":"Zone spécialement protégée de l'Antarctique no 140","ref":"ASPA 140","since":1985,"criteria":[],"url":"https://www.ats.aq/devAS/Meetings/Measure/765"}],"managing_body":{"name":"Parties au Traité sur l'Antarctique","url":"https://www.ats.aq/"}},"editorial":{"badges":["unique-au-monde","geologie-remarquable","tres-sauvage"],"essential":false,"lede":"Un volcan actif forme un anneau presque fermé autour d'une baie antarctique, où chaleur géothermique, cendres noires et colonies de manchots se touchent.","why_here":"Rares sont les lieux où une caldeira active, envahie par la mer, devient à la fois port naturel, laboratoire géothermique et refuge biologique polaire. Le contraste entre neige, scories et vapeur apporte un mécanisme irremplaçable à la sélection.","presentation":"L'île dessine un fer à cheval de roches sombres autour de Port Foster. La mer n'entre que par un passage étroit, ouverture d'une caldeira dont le plancher s'est effondré puis a été noyé. Le paysage n'est donc pas un simple cratère côtier, mais le toit brisé d'un système volcanique encore actif.\n\nLes éruptions de 1967, 1969 et 1970 ont endommagé des stations scientifiques et remodelé des secteurs du rivage. Fumerolles, sols chauds et gradients thermiques entretiennent des communautés végétales et microbiennes inhabituelles sous cette latitude.\n\nSur les pentes externes, de grandes colonies de manchots à jugulaire exploitent les eaux riches de l'océan Austral. L'île réunit ainsi deux dynamiques rarement juxtaposées : la chaleur interne de la Terre et la productivité d'une mer froide.","geology":"La caldeira résulte de plusieurs phases explosives et d'effondrement liées à un volcanisme de marge active dans les Shetland du Sud. Des fissures ont alimenté les éruptions historiques. Les dépôts de cendres, tufs et scories sont facilement érodés par le vent, la fonte et les vagues.","dynamics":"Le système est qualifié d'actif et agité. Déformation, séismes et géothermie sont surveillés, car une nouvelle éruption reste possible. La chaleur locale fait fondre neige et glace, mais elle ne rend pas le milieu sûr.","biodiversity_text":"Le plan de gestion signale au moins dix-huit espèces végétales non connues ailleurs en Antarctique ainsi que des communautés liées aux sols chauffés. Neuf oiseaux marins se reproduisent sur l'île, avec une très grande concentration de manchots à jugulaire.","in_motion":"Les pentes friables changent après chaque épisode volcanique ou tempête. La fréquentation doit composer avec un risque éruptif réel, des vestiges historiques et une végétation que quelques pas peuvent durablement dégrader.","guess_hints":["Une baie presque fermée occupe une caldeira","Trois éruptions ont frappé entre 1967 et 1970","Des plantes profitent de sols chauffés sous une latitude polaire","Une immense colonie de manchots niche sur les pentes externes"]},"figures":[{"label":"Superficie","value":"environ 98,5 km²"},{"label":"Éruptions récentes majeures","value":"1967, 1969 et 1970"},{"label":"Sommet","value":"539 m"}],"geology":{"age":"Volcanisme quaternaire et historique","processes":["effondrement de caldeira","volcanisme fissural","géothermie","érosion marine"],"rock_types":["basalte","andésite","tuf","scories"],"volcanic":{"gvp_number":"390030","type":"caldeira volcanique inondée","last_eruption":"1970","status":"actif et surveillé"}},"biodiversity":{"flagship_species":[{"name_fr":"Manchot à jugulaire","name_sci":"Pygoscelis antarcticus","group":"oiseau","iucn_status":"LC"},{"name_fr":"Sagine antarctique","name_sci":"Colobanthus quitensis","group":"plante","iucn_status":null}],"endemism_level":"eleve","endemism_note":"Les sols géothermiques abritent plusieurs assemblages végétaux extrêmement localisés.","species_counts":{"note":"Le plan de gestion mentionne au moins 18 espèces végétales non enregistrées ailleurs en Antarctique."}},"seasonality":{"best_months":[11,12,1,2,3],"avoid_months":[5,6,7,8],"phenomena":[{"label":"Reproduction des oiseaux marins","kind":"migration","months":[11,12,1,2]},{"label":"Neige et glace saisonnières maximales","kind":"glace","months":[6,7,8,9]}],"notes":"La sécurité volcanique et les restrictions de protection priment sur toute saison théorique."},"visit":{"accessibility":"expedition","suggested_duration":"À comprendre à distance ou dans une visite antarctique autorisée","difficulty":"Volcan actif, météo polaire, terrain friable et secours éloignés.","extreme_conditions":["risque volcanique","froid","vent","terrain instable"],"permits":"Activités encadrées par le Traité sur l'Antarctique, le plan ASMA 4 et les zones ASPA.","rules":["Ne pas entrer dans une zone protégée sans autorisation.","Ne pas marcher sur la végétation ni approcher la faune.","Respecter les fermetures liées au risque volcanique."],"official_url":"https://www.ats.aq/devAS/Ats/Guideline/37dd76bd-0441-4276-aed0-39223d6caf87","no_route_guidance":true},"conservation":{"fragility":"critique","state":"La protection doit concilier volcanisme imprévisible, végétation géothermique minuscule, colonies d'oiseaux et vestiges historiques très fréquentés.","trend":"inconnue","threats":[{"type":"tourisme","level":"eleve","note":"Piétinement, dérangement et concentration sur quelques plages."},{"type":"climat","level":"eleve","note":"Modification de la neige, des habitats et des réseaux marins."}],"understand_without_going":true,"message":"La chaleur du sol ne transforme jamais ce volcan antarctique en attraction balnéaire sans risque."},"media":{"hero":null,"gallery":[],"query":"Deception Island Antarctica caldera chinstrap penguins"},"sources":[{"title":"Deception Island Antarctic Specially Managed Area management plan","publisher":"Antarctic Treaty Secretariat","url":"https://documents.ats.aq/recatt/att512_e.pdf","type":"officiel","accessed":"2026-08-23"},{"title":"Visitor Site Guide: Deception Island","publisher":"Antarctic Treaty Secretariat","url":"https://www.ats.aq/devAS/Ats/Guideline/37dd76bd-0441-4276-aed0-39223d6caf87","type":"officiel","accessed":"2026-08-23"}]}
