{"id":"auyuittuq","collection":"hundred","status":"fact_checked","last_verified":"2026-08-23","identity":{"name_fr":"Parc national Auyuittuq","name_official":"Auyuittuq National Park","name_local":[{"lang":"iu","value":"ᐊᐅᔪᐃᑦᑐᖅ"}],"name_indigenous":[{"people":"Inuit","value":"Auyuittuq","meaning":"la terre qui ne fond jamais"}],"aka":["Auyuittuq"]},"location":{"countries":["CA"],"country_labels":["Canada"],"subdivision":"Nunavut, île de Baffin","region":"polaire","lat":67.5,"lng":-66,"coordinate_precision":"region","bbox":[-70,66,-62,69],"area_km2":19707.4,"elevation_min_m":0,"elevation_max_m":2147,"depth_max_m":null,"timezone":"America/Pangnirtung"},"landscape":{"primary":"montagne","types":["montagne","glacier","inlandsis","polaire","fjord"],"family":"polaire","iucn_ecosystem":["T6.5 Désert polaire","T6.3 Toundra arctique"],"biome":"Montagnes arctiques, calotte glaciaire, vallées et fjords","climate":"Polaire arctique","collections":["vertiges","mondes-de-glace","bouts-du-monde","paysages-en-transformation"]},"protection":{"designations":[{"type":"national-park","name":"Parc national Auyuittuq","since":1976,"criteria":[],"ref":null,"url":"https://parks.canada.ca/pn-np/nu/auyuittuq"}],"managing_body":{"name":"Parcs Canada avec les communautés inuit concernées","url":"https://parks.canada.ca/pn-np/nu/auyuittuq"}},"editorial":{"badges":["grande-nature","geologie-remarquable","tres-sauvage"],"essential":false,"lede":"Une calotte relique domine des vallées glaciaires et des monolithes de granite, dont le mont Thor présente l'une des plus hautes parois continues de la planète.","why_here":"Auyuittuq unit le temps profond du Bouclier canadien, l'héritage de l'inlandsis laurentidien et des reliefs verticaux devenus emblématiques. Son nom inuit replace justement la glace et le territoire habité au centre du récit.","presentation":"Sur l'île de Baffin, les monts Baffin dressent au-dessus des fjords des murs de granite, de gneiss et de roches métamorphiques très anciennes. Le mont Thor est célèbre pour sa paroi ouest, un dénivelé continu d'environ 1 250 mètres avec une partie en surplomb. Le mont Asgard forme deux tours jumelles au-dessus des vallées.\n\nEntre ces reliefs repose la calotte Penny, vestige de l'inlandsis laurentidien qui couvrait une grande part du Canada. Ses glaciers descendent dans des vallées en U, alimentent rivières de fonte et abandonnent moraines, blocs et roches polies.\n\nAuyuittuq n'est pas une étendue vide. Le parc se trouve dans le Nunavut, au sein d'un territoire inuit parcouru, nommé et connu depuis des générations. Sa gestion et son interprétation doivent associer savoir scientifique, sécurité et connaissances inuit.","geology":"Le socle précambrien du Bouclier canadien a été métamorphisé et intrudé il y a des milliards d'années. Soulèvement, fractures puis glaciations ont dégagé les parois. La glace a élargi les vallées et accentué les contrastes entre sommets résistants et couloirs surcreusés.","dynamics":"La calotte accumule de la neige mais perd de la masse par fonte et écoulement. Les rivières gonflent rapidement en été, tandis que gel, dégel et chutes de pierres travaillent les parois. Le pergélisol stabilise puis fragilise les versants selon la température.","biodiversity_text":"Toundra, zones humides et côtes accueillent caribou de Peary, lièvre arctique, renard arctique, oiseaux migrateurs et mammifères marins. La productivité se concentre pendant un été bref.","in_motion":"La calotte Penny s'amincit et recule sous le réchauffement arctique. Les traversées de rivières et la stabilité du terrain changent au cours d'une saison, preuve directe que la fonte transforme aussi les usages humains.","guess_hints":["Le nom local signifie la terre qui ne fond jamais","Une paroi continue chute sur environ 1 250 mètres","Une calotte est un reste de l'inlandsis laurentidien","Le territoire est géré avec les communautés inuit"]},"figures":[{"label":"Superficie du parc","value":"19 707 km²"},{"label":"Paroi du mont Thor","value":"environ 1 250 m"},{"label":"Point culminant du parc","value":"environ 2 147 m"}],"geology":{"age":"Socle précambrien, relief exhumé et glaciations quaternaires","processes":["métamorphisme","fracturation","érosion glaciaire","gélifraction","retrait glaciaire"],"rock_types":["granite","gneiss","roches métamorphiques"],"volcanic":null},"biodiversity":{"flagship_species":[{"name_fr":"Caribou de Peary","name_sci":"Rangifer tarandus pearyi","group":"mammifère","iucn_status":"EN"},{"name_fr":"Renard arctique","name_sci":"Vulpes lagopus","group":"mammifère","iucn_status":"LC"},{"name_fr":"Lièvre arctique","name_sci":"Lepus arcticus","group":"mammifère","iucn_status":"LC"}],"endemism_level":"faible","endemism_note":"La faune appartient largement au haut Arctique canadien, avec des populations adaptées et vulnérables.","species_counts":null},"seasonality":{"best_months":[6,7,8],"avoid_months":[10,11,12,1,2,3,4],"phenomena":[{"label":"Soleil de minuit et fonte estivale","kind":"soleil-de-minuit","months":[6,7]},{"label":"Rivières de fonte au débit maximal","kind":"fonte","months":[7,8]}],"notes":"Les conditions et fermetures doivent être vérifiées auprès de Parcs Canada; aucune route détaillée n'est donnée ici."},"visit":{"accessibility":"expedition","suggested_duration":"À préparer uniquement avec les informations actuelles de Parcs Canada et des communautés","difficulty":"Isolement, rivières sans pont, froid, ours, terrain glaciaire et communications limitées.","extreme_conditions":["hypothermie","crues soudaines","ours polaires","crevasses","isolement"],"permits":"Inscription, séances d'orientation et règles de Parcs Canada selon l'activité et la saison.","rules":["Consulter exclusivement les avis officiels actualisés.","Respecter les terres, les sites culturels et les connaissances inuit.","Ne pas s'engager sans autonomie, équipement et compétences adaptés."],"official_url":"https://parks.canada.ca/pn-np/nu/auyuittuq","no_route_guidance":true},"conservation":{"fragility":"critique","state":"Le parc reste vaste et protégé, mais recul de la calotte, dégel et changements hydrologiques transforment rapidement ses paysages et ses usages.","trend":"degradation","threats":[{"type":"climat","level":"critique","note":"Réchauffement arctique, dégel et modification des régimes de neige."},{"type":"fonte-glaciaire","level":"critique","note":"Amincissement et recul de la calotte Penny."},{"type":"tourisme","level":"modere","note":"Impacts localisés dans un milieu à récupération lente."}],"understand_without_going":false,"message":"Le nom d'Auyuittuq porte une mémoire de la permanence de la glace que le climat actuel remet en question."},"media":{"hero":null,"gallery":[],"query":"Auyuittuq Mount Thor Penny Ice Cap Nunavut"},"sources":[{"title":"Auyuittuq National Park","publisher":"Parks Canada","url":"https://parks.canada.ca/pn-np/nu/auyuittuq","type":"officiel","accessed":"2026-08-23"},{"title":"Penny Ice Cap","publisher":"Natural Resources Canada","url":"https://natural-resources.canada.ca/","type":"officiel","accessed":"2026-08-23"}]}
